{
  "$schema": "https://json-schema.org/draft/2020-12/schema",
  "$id": "https://softdata-api.local/schemas/finance/currencies.schema.json",
  "title": "World Currencies",
  "description": "Schema for the world-currencies dataset compiled by SoftData from the current ISO 4217 monetary-currency snapshot.",
  "type": "array",
  "minItems": 155,
  "maxItems": 155,
  "uniqueItems": true,
  "items": {
    "type": "object",
    "additionalProperties": false,
    "required": [
      "id",
      "name",
      "alphabetic_code",
      "numeric_code",
      "minor_unit",
      "country_area_ids"
    ],
    "properties": {
      "id": {
        "type": "string",
        "pattern": "^[a-z]{3}$"
      },
      "name": {
        "type": "string",
        "minLength": 1
      },
      "alphabetic_code": {
        "type": "string",
        "pattern": "^[A-Z]{3}$"
      },
      "numeric_code": {
        "type": "string",
        "pattern": "^[0-9]{3}$"
      },
      "minor_unit": {
        "type": "integer",
        "enum": [
          0,
          2,
          3
        ]
      },
      "country_area_ids": {
        "type": "array",
        "uniqueItems": true,
        "items": {
          "type": "string",
          "enum": [
            "af",
            "al",
            "dz",
            "as",
            "ad",
            "ao",
            "ai",
            "aq",
            "ag",
            "ar",
            "am",
            "aw",
            "au",
            "at",
            "az",
            "bs",
            "bh",
            "bd",
            "bb",
            "by",
            "be",
            "bz",
            "bj",
            "bm",
            "bt",
            "bo",
            "bq",
            "ba",
            "bw",
            "bv",
            "br",
            "io",
            "vg",
            "bn",
            "bg",
            "bf",
            "bi",
            "cv",
            "kh",
            "cm",
            "ca",
            "ky",
            "cf",
            "td",
            "cl",
            "cn",
            "hk",
            "mo",
            "cx",
            "cc",
            "co",
            "km",
            "cg",
            "ck",
            "cr",
            "hr",
            "cu",
            "cw",
            "cy",
            "cz",
            "ci",
            "kp",
            "cd",
            "dk",
            "dj",
            "dm",
            "do",
            "ec",
            "eg",
            "sv",
            "gq",
            "er",
            "ee",
            "sz",
            "et",
            "fk",
            "fo",
            "fj",
            "fi",
            "fr",
            "gf",
            "pf",
            "tf",
            "ga",
            "gm",
            "ge",
            "de",
            "gh",
            "gi",
            "gr",
            "gl",
            "gd",
            "gp",
            "gu",
            "gt",
            "gg",
            "gn",
            "gw",
            "gy",
            "ht",
            "hm",
            "va",
            "hn",
            "hu",
            "is",
            "in",
            "id",
            "ir",
            "iq",
            "ie",
            "im",
            "il",
            "it",
            "jm",
            "jp",
            "je",
            "jo",
            "kz",
            "ke",
            "ki",
            "kw",
            "kg",
            "la",
            "lv",
            "lb",
            "ls",
            "lr",
            "ly",
            "li",
            "lt",
            "lu",
            "mg",
            "mw",
            "my",
            "mv",
            "ml",
            "mt",
            "mh",
            "mq",
            "mr",
            "mu",
            "yt",
            "mx",
            "fm",
            "mc",
            "mn",
            "me",
            "ms",
            "ma",
            "mz",
            "mm",
            "na",
            "nr",
            "np",
            "nl",
            "nc",
            "nz",
            "ni",
            "ne",
            "ng",
            "nu",
            "nf",
            "mk",
            "mp",
            "no",
            "om",
            "pk",
            "pw",
            "pa",
            "pg",
            "py",
            "pe",
            "ph",
            "pn",
            "pl",
            "pt",
            "pr",
            "qa",
            "kr",
            "md",
            "ro",
            "ru",
            "rw",
            "re",
            "bl",
            "sh",
            "mf",
            "pm",
            "vc",
            "ws",
            "sm",
            "st",
            "sa",
            "sn",
            "rs",
            "sc",
            "sl",
            "sg",
            "sx",
            "sk",
            "si",
            "sb",
            "so",
            "za",
            "gs",
            "ss",
            "es",
            "lk",
            "kn",
            "lc",
            "ps",
            "sd",
            "sr",
            "sj",
            "se",
            "ch",
            "sy",
            "tj",
            "th",
            "tl",
            "tg",
            "tk",
            "to",
            "tt",
            "tn",
            "tm",
            "tc",
            "tv",
            "tr",
            "ug",
            "ua",
            "ae",
            "gb",
            "tz",
            "um",
            "vi",
            "us",
            "uy",
            "uz",
            "vu",
            "ve",
            "vn",
            "wf",
            "eh",
            "ye",
            "zm",
            "zw",
            "ax"
          ]
        }
      }
    }
  }
}
