[
  {
    "id": "afn",
    "name": "Afghani",
    "alphabetic_code": "AFN",
    "numeric_code": "971",
    "minor_unit": 2,
    "country_area_ids": [
      "af"
    ]
  },
  {
    "id": "dzd",
    "name": "Algerian Dinar",
    "alphabetic_code": "DZD",
    "numeric_code": "012",
    "minor_unit": 2,
    "country_area_ids": [
      "dz"
    ]
  },
  {
    "id": "ars",
    "name": "Argentine Peso",
    "alphabetic_code": "ARS",
    "numeric_code": "032",
    "minor_unit": 2,
    "country_area_ids": [
      "ar"
    ]
  },
  {
    "id": "amd",
    "name": "Armenian Dram",
    "alphabetic_code": "AMD",
    "numeric_code": "051",
    "minor_unit": 2,
    "country_area_ids": [
      "am"
    ]
  },
  {
    "id": "awg",
    "name": "Aruban Florin",
    "alphabetic_code": "AWG",
    "numeric_code": "533",
    "minor_unit": 2,
    "country_area_ids": [
      "aw"
    ]
  },
  {
    "id": "aud",
    "name": "Australian Dollar",
    "alphabetic_code": "AUD",
    "numeric_code": "036",
    "minor_unit": 2,
    "country_area_ids": [
      "au",
      "cc",
      "cx",
      "hm",
      "ki",
      "nf",
      "nr",
      "tv"
    ]
  },
  {
    "id": "azn",
    "name": "Azerbaijan Manat",
    "alphabetic_code": "AZN",
    "numeric_code": "944",
    "minor_unit": 2,
    "country_area_ids": [
      "az"
    ]
  },
  {
    "id": "bsd",
    "name": "Bahamian Dollar",
    "alphabetic_code": "BSD",
    "numeric_code": "044",
    "minor_unit": 2,
    "country_area_ids": [
      "bs"
    ]
  },
  {
    "id": "bhd",
    "name": "Bahraini Dinar",
    "alphabetic_code": "BHD",
    "numeric_code": "048",
    "minor_unit": 3,
    "country_area_ids": [
      "bh"
    ]
  },
  {
    "id": "thb",
    "name": "Baht",
    "alphabetic_code": "THB",
    "numeric_code": "764",
    "minor_unit": 2,
    "country_area_ids": [
      "th"
    ]
  },
  {
    "id": "pab",
    "name": "Balboa",
    "alphabetic_code": "PAB",
    "numeric_code": "590",
    "minor_unit": 2,
    "country_area_ids": [
      "pa"
    ]
  },
  {
    "id": "bbd",
    "name": "Barbados Dollar",
    "alphabetic_code": "BBD",
    "numeric_code": "052",
    "minor_unit": 2,
    "country_area_ids": [
      "bb"
    ]
  },
  {
    "id": "byn",
    "name": "Belarusian Ruble",
    "alphabetic_code": "BYN",
    "numeric_code": "933",
    "minor_unit": 2,
    "country_area_ids": [
      "by"
    ]
  },
  {
    "id": "bzd",
    "name": "Belize Dollar",
    "alphabetic_code": "BZD",
    "numeric_code": "084",
    "minor_unit": 2,
    "country_area_ids": [
      "bz"
    ]
  },
  {
    "id": "bmd",
    "name": "Bermudian Dollar",
    "alphabetic_code": "BMD",
    "numeric_code": "060",
    "minor_unit": 2,
    "country_area_ids": [
      "bm"
    ]
  },
  {
    "id": "bob",
    "name": "Boliviano",
    "alphabetic_code": "BOB",
    "numeric_code": "068",
    "minor_unit": 2,
    "country_area_ids": [
      "bo"
    ]
  },
  {
    "id": "ved",
    "name": "Bolívar Soberano",
    "alphabetic_code": "VED",
    "numeric_code": "926",
    "minor_unit": 2,
    "country_area_ids": [
      "ve"
    ]
  },
  {
    "id": "ves",
    "name": "Bolívar Soberano",
    "alphabetic_code": "VES",
    "numeric_code": "928",
    "minor_unit": 2,
    "country_area_ids": [
      "ve"
    ]
  },
  {
    "id": "brl",
    "name": "Brazilian Real",
    "alphabetic_code": "BRL",
    "numeric_code": "986",
    "minor_unit": 2,
    "country_area_ids": [
      "br"
    ]
  },
  {
    "id": "bnd",
    "name": "Brunei Dollar",
    "alphabetic_code": "BND",
    "numeric_code": "096",
    "minor_unit": 2,
    "country_area_ids": [
      "bn"
    ]
  },
  {
    "id": "bif",
    "name": "Burundi Franc",
    "alphabetic_code": "BIF",
    "numeric_code": "108",
    "minor_unit": 0,
    "country_area_ids": [
      "bi"
    ]
  },
  {
    "id": "xof",
    "name": "CFA Franc BCEAO",
    "alphabetic_code": "XOF",
    "numeric_code": "952",
    "minor_unit": 0,
    "country_area_ids": [
      "bf",
      "bj",
      "ci",
      "gw",
      "ml",
      "ne",
      "sn",
      "tg"
    ]
  },
  {
    "id": "xaf",
    "name": "CFA Franc BEAC",
    "alphabetic_code": "XAF",
    "numeric_code": "950",
    "minor_unit": 0,
    "country_area_ids": [
      "cf",
      "cg",
      "cm",
      "ga",
      "gq",
      "td"
    ]
  },
  {
    "id": "xpf",
    "name": "CFP Franc",
    "alphabetic_code": "XPF",
    "numeric_code": "953",
    "minor_unit": 0,
    "country_area_ids": [
      "nc",
      "pf",
      "wf"
    ]
  },
  {
    "id": "cve",
    "name": "Cabo Verde Escudo",
    "alphabetic_code": "CVE",
    "numeric_code": "132",
    "minor_unit": 2,
    "country_area_ids": [
      "cv"
    ]
  },
  {
    "id": "cad",
    "name": "Canadian Dollar",
    "alphabetic_code": "CAD",
    "numeric_code": "124",
    "minor_unit": 2,
    "country_area_ids": [
      "ca"
    ]
  },
  {
    "id": "xcg",
    "name": "Caribbean Guilder",
    "alphabetic_code": "XCG",
    "numeric_code": "532",
    "minor_unit": 2,
    "country_area_ids": [
      "cw",
      "sx"
    ]
  },
  {
    "id": "kyd",
    "name": "Cayman Islands Dollar",
    "alphabetic_code": "KYD",
    "numeric_code": "136",
    "minor_unit": 2,
    "country_area_ids": [
      "ky"
    ]
  },
  {
    "id": "clp",
    "name": "Chilean Peso",
    "alphabetic_code": "CLP",
    "numeric_code": "152",
    "minor_unit": 0,
    "country_area_ids": [
      "cl"
    ]
  },
  {
    "id": "cop",
    "name": "Colombian Peso",
    "alphabetic_code": "COP",
    "numeric_code": "170",
    "minor_unit": 2,
    "country_area_ids": [
      "co"
    ]
  },
  {
    "id": "kmf",
    "name": "Comorian Franc",
    "alphabetic_code": "KMF",
    "numeric_code": "174",
    "minor_unit": 0,
    "country_area_ids": [
      "km"
    ]
  },
  {
    "id": "cdf",
    "name": "Congolese Franc",
    "alphabetic_code": "CDF",
    "numeric_code": "976",
    "minor_unit": 2,
    "country_area_ids": [
      "cd"
    ]
  },
  {
    "id": "bam",
    "name": "Convertible Mark",
    "alphabetic_code": "BAM",
    "numeric_code": "977",
    "minor_unit": 2,
    "country_area_ids": [
      "ba"
    ]
  },
  {
    "id": "nio",
    "name": "Cordoba Oro",
    "alphabetic_code": "NIO",
    "numeric_code": "558",
    "minor_unit": 2,
    "country_area_ids": [
      "ni"
    ]
  },
  {
    "id": "crc",
    "name": "Costa Rican Colon",
    "alphabetic_code": "CRC",
    "numeric_code": "188",
    "minor_unit": 2,
    "country_area_ids": [
      "cr"
    ]
  },
  {
    "id": "cup",
    "name": "Cuban Peso",
    "alphabetic_code": "CUP",
    "numeric_code": "192",
    "minor_unit": 2,
    "country_area_ids": [
      "cu"
    ]
  },
  {
    "id": "czk",
    "name": "Czech Koruna",
    "alphabetic_code": "CZK",
    "numeric_code": "203",
    "minor_unit": 2,
    "country_area_ids": [
      "cz"
    ]
  },
  {
    "id": "gmd",
    "name": "Dalasi",
    "alphabetic_code": "GMD",
    "numeric_code": "270",
    "minor_unit": 2,
    "country_area_ids": [
      "gm"
    ]
  },
  {
    "id": "dkk",
    "name": "Danish Krone",
    "alphabetic_code": "DKK",
    "numeric_code": "208",
    "minor_unit": 2,
    "country_area_ids": [
      "dk",
      "fo",
      "gl"
    ]
  },
  {
    "id": "mkd",
    "name": "Denar",
    "alphabetic_code": "MKD",
    "numeric_code": "807",
    "minor_unit": 2,
    "country_area_ids": [
      "mk"
    ]
  },
  {
    "id": "djf",
    "name": "Djibouti Franc",
    "alphabetic_code": "DJF",
    "numeric_code": "262",
    "minor_unit": 0,
    "country_area_ids": [
      "dj"
    ]
  },
  {
    "id": "stn",
    "name": "Dobra",
    "alphabetic_code": "STN",
    "numeric_code": "930",
    "minor_unit": 2,
    "country_area_ids": [
      "st"
    ]
  },
  {
    "id": "dop",
    "name": "Dominican Peso",
    "alphabetic_code": "DOP",
    "numeric_code": "214",
    "minor_unit": 2,
    "country_area_ids": [
      "do"
    ]
  },
  {
    "id": "vnd",
    "name": "Dong",
    "alphabetic_code": "VND",
    "numeric_code": "704",
    "minor_unit": 0,
    "country_area_ids": [
      "vn"
    ]
  },
  {
    "id": "xcd",
    "name": "East Caribbean Dollar",
    "alphabetic_code": "XCD",
    "numeric_code": "951",
    "minor_unit": 2,
    "country_area_ids": [
      "ag",
      "ai",
      "dm",
      "gd",
      "kn",
      "lc",
      "ms",
      "vc"
    ]
  },
  {
    "id": "egp",
    "name": "Egyptian Pound",
    "alphabetic_code": "EGP",
    "numeric_code": "818",
    "minor_unit": 2,
    "country_area_ids": [
      "eg"
    ]
  },
  {
    "id": "svc",
    "name": "El Salvador Colon",
    "alphabetic_code": "SVC",
    "numeric_code": "222",
    "minor_unit": 2,
    "country_area_ids": [
      "sv"
    ]
  },
  {
    "id": "etb",
    "name": "Ethiopian Birr",
    "alphabetic_code": "ETB",
    "numeric_code": "230",
    "minor_unit": 2,
    "country_area_ids": [
      "et"
    ]
  },
  {
    "id": "eur",
    "name": "Euro",
    "alphabetic_code": "EUR",
    "numeric_code": "978",
    "minor_unit": 2,
    "country_area_ids": [
      "ad",
      "at",
      "ax",
      "be",
      "bg",
      "bl",
      "cy",
      "de",
      "ee",
      "es",
      "fi",
      "fr",
      "gf",
      "gp",
      "gr",
      "hr",
      "ie",
      "it",
      "lt",
      "lu",
      "lv",
      "mc",
      "me",
      "mf",
      "mq",
      "mt",
      "nl",
      "pm",
      "pt",
      "re",
      "si",
      "sk",
      "sm",
      "tf",
      "va",
      "yt"
    ]
  },
  {
    "id": "fkp",
    "name": "Falkland Islands Pound",
    "alphabetic_code": "FKP",
    "numeric_code": "238",
    "minor_unit": 2,
    "country_area_ids": [
      "fk"
    ]
  },
  {
    "id": "fjd",
    "name": "Fiji Dollar",
    "alphabetic_code": "FJD",
    "numeric_code": "242",
    "minor_unit": 2,
    "country_area_ids": [
      "fj"
    ]
  },
  {
    "id": "huf",
    "name": "Forint",
    "alphabetic_code": "HUF",
    "numeric_code": "348",
    "minor_unit": 2,
    "country_area_ids": [
      "hu"
    ]
  },
  {
    "id": "ghs",
    "name": "Ghana Cedi",